{
  "$schema": "https://json-schema.org/draft/2020-12/schema",
  "$id": "https://sprout.example/contracts/schemas/ota_release.schema.json",
  "title": "OTA release contract",
  "type": "object",
  "additionalProperties": false,
  "required": [
    "schema_version",
    "release_id",
    "firmware_version",
    "hardware_revision",
    "channel",
    "artifact_key",
    "sha256",
    "size_bytes",
    "signature_key_id",
    "rollback_allowed",
    "published_at"
  ],
  "properties": {
    "schema_version": {
      "type": "string",
      "const": "1.0.0"
    },
    "release_id": {
      "$ref": "https://sprout.example/contracts/schemas/common.schema.json#/$defs/identifier"
    },
    "firmware_version": {
      "$ref": "https://sprout.example/contracts/schemas/common.schema.json#/$defs/firmware_version"
    },
    "hardware_revision": {
      "type": "string",
      "pattern": "^[a-z0-9][a-z0-9_-]{0,31}$"
    },
    "channel": {
      "type": "string",
      "enum": [
        "stable",
        "canary",
        "internal"
      ]
    },
    "artifact_key": {
      "$ref": "https://sprout.example/contracts/schemas/common.schema.json#/$defs/object_key"
    },
    "sha256": {
      "$ref": "https://sprout.example/contracts/schemas/common.schema.json#/$defs/sha256"
    },
    "size_bytes": {
      "type": "integer",
      "minimum": 1,
      "maximum": 16777216
    },
    "signature_key_id": {
      "$ref": "https://sprout.example/contracts/schemas/common.schema.json#/$defs/identifier"
    },
    "rollback_allowed": {
      "type": "boolean"
    },
    "published_at": {
      "$ref": "https://sprout.example/contracts/schemas/common.schema.json#/$defs/timestamp"
    }
  }
}
